title,publisher,published,datetime,description,link,image,authors,text_preview
This 90s Dystopian Series is the Greatest Sci-Fi Anime of All Time,Comic Book Resources,9 minutes ago,2025-11-17 10:36:27.741274,Blue Submarine No. 6 is a revelatory science fiction anime from the '90s and a hidden gem that's more relevant than ever.,https://www.cbr.com/best-sci-fi-90s-anime-blue-submarine-no-6/&ved=2ahUKEwjQv6D5tviQAxX43TgGHTnULzYQxfQBegQICBAC&usg=AOvVaw0qtKv2-Y2DlRH46ZJk-Nu_,"data:image/gif;base64,R0lGODlhAQABAIAAAP///////yH5BAEKAAEALAAAAAABAAEAAAICTAEAOw==",N/A,
"18 Years Later, This Throwaway Evangelion Quote Still Drives Me Crazy",Comic Book Resources,9 minutes ago,2025-11-17 10:36:27.762691,"When it comes to popular anime series, few are more complicated than Hideaki Anno's iconic brainchild, Neon Genesis Evangelion.",https://www.cbr.com/evangelion-rebuild-kaworu-timeloop-comment/&ved=2ahUKEwjQv6D5tviQAxX43TgGHTnULzYQxfQBegQIAhAC&usg=AOvVaw07DSET_rZBNzBQY1SyMTvQ,"data:image/gif;base64,R0lGODlhAQABAIAAAP///////yH5BAEKAAEALAAAAAABAAEAAAICTAEAOw==",N/A,
"Killed Again, Mr. Detective? Anime To Premiere in April 2026",Anime Trending,4 minutes ago,2025-11-17 10:41:27.766712,"A TV anime adaptation of the Killed Again, Mr. Detective? light novel series (not to be confused with The Detective Is Already Dead) has been announced with...",https://anitrendz.net/news/2025/11/16/killed-again-mr-detective-anime-to-premiere-in-april-2026/&ved=2ahUKEwjQv6D5tviQAxX43TgGHTnULzYQxfQBegQIChAC&usg=AOvVaw2Rolf8p0rgerPnFduNORQq,"data:image/gif;base64,R0lGODlhAQABAIAAAP///////yH5BAEKAAEALAAAAAABAAEAAAICTAEAOw==",N/A,
Anime Legends Unite: Where You’ve Heard Inazuma Eleven Victory Road’s Voice Cast,TechnoSports Media Group,7 minutes ago,2025-11-17 10:38:27.770057,Ever wondered why certain characters sound so familiar in Inazuma Eleven Victory Road? That's because Level-5 assembled an all-star roster of anime voice.,https://technosports.co.in/anime-legends-unite-where-youve-heard-inazuma/&ved=2ahUKEwjQv6D5tviQAxX43TgGHTnULzYQxfQBegQIBxAC&usg=AOvVaw0JRXZnuJ_faAvvyNnX1FXs,"data:image/gif;base64,R0lGODlhAQABAIAAAP///////yH5BAEKAAEALAAAAAABAAEAAAICTAEAOw==",N/A,
Even Black Clover’s Cast Says the Anime Is Long Overdue for a New Movie,Screen Rant,1 hour ago,2025-11-17 09:45:27.784734,"Black Clover has truly begun to shine in the manga's twilight years, thanks to the manga getting an appropriate, well-deserved sendoff and the anime a...",https://screenrant.com/black-clover-anime-new-movie/&ved=2ahUKEwjQv6D5tviQAxX43TgGHTnULzYQxfQBegQIBhAC&usg=AOvVaw1wcK7QR46GnTannSXXZu2F,"data:image/gif;base64,R0lGODlhAQABAIAAAP///////yH5BAEKAAEALAAAAAABAAEAAAICTAEAOw==",N/A,
